<?xml version="1.0" encoding="UTF-8"?>
<Objects xmlns="http://www.gonicus.de/Objects" xmlns:xsi="http://www.w3.org/2001/XMLSchema-instance" xsi:schemaLocation="http://www.gonicus.de/Objects ../object.xsd ">
	<Object>
		<Name>PeopleContainer</Name>
		<DisplayName>Container for users</DisplayName>
		<Description>Organizational unit that can contain users</Description>
		<BackendParameters>
			<Backend objectClasses="organizationalUnit" RDN="ou">LDAP</Backend>
		</BackendParameters>
		<Backend>LDAP</Backend>
		<Container>
			<Type>User</Type>
		</Container>
		<BaseObject>true</BaseObject>
		<FixedRDN>ou=people</FixedRDN>
		<StructuralInvisible>true</StructuralInvisible>
	</Object>
</Objects>

